,HIOS ID,HIOS INPUTTED INSURANCE COMPANY NAME,STATE,REINSURANCE PAYMENT AMOUNT (OR NOT ELIGIBLE),"HHS RISK ADJUSTMENT TRANSFER AMOUNT (INDIVIDUAL MARKET, INCLUDING CATASTROPHIC)",HHS RISK ADJUSTMENT TRANSFERS AMOUNT (SMALL GROUP MARKET)
0,11082,Aetna Life Insurance Company,AK,N/E,$-,"($1,188,058.34)"
1,38344,Premera Blue Cross,AK,"$5,758,679.10","$11,418,310.79","$4,017,476.01"
2,73836,Moda Health Plan Inc,AK,"$8,987,021.64","($11,418,310.77)","($2,026,261.96)"
3,80049,UnitedHealthcare Insurance Company,AK,N/E,$-,"($803,155.69)"
4,44580,Humana Insurance Company,AL,"$2,298,478.10","($13,518,890.18)",$-
5,44902,Federated Mutual Insurance Company,AL,N/E,$-,"($32,889.86)"
6,46944,Blue Cross and Blue Shield of Alabama,AL,"$48,065,429.70","$24,939,398.79","$2,294,842.22"
7,59809,UnitedHealthcare Life Insurance Company,AL,"$111,220.27","($959,823.85)",$-
8,68259,"UnitedHealthcare of Alabama, Inc.",AL,"$8,739,396.74","($10,457,177.89)","($1,064,013.58)"
9,69461,UnitedHealthcare Insurance Company,AL,N/E,$-,"($51,436.04)"
10,93018,"Viva Health, Inc.",AL,N/E,$-,"($1,146,502.70)"
11,93122,Freedom Life Insurance Company of America,AL,$0.00,"($3,506.92)",$-
12,13262,USAble Mutual Insurance Company,AR,N/E,$-,"($32,736.62)"
13,22732,UnitedHealthcare Insurance Company of the River Valley,AR,N/E,$-,"$56,688.96"
14,37903,"Qualchoice Life and Health Insurance Company, INC",AR,"$5,901,467.15","$6,169,439.47","($135,289.79)"
15,53135,UnitedHealthcare Life Insurance Company,AR,"$314,611.24","($189,796.85)",$-
16,60079,Coventry Health and Life,AR,$0.00,"($12,964.94)","($17,774.27)"
17,61273,Freedom Life Insurance Company of America,AR,$0.00,"$8,241.41",$-
18,62141,Celtic Insurance Company,AR,"$4,667,143.01","($3,996,497.96)",$-
19,65817,"UnitedHealthcare of Arkansas, Inc.",AR,"$878,465.85","($3,066,401.15)","($602,953.44)"
20,70525,QCA Health Plan INC,AR,"$5,970,119.58","$2,856,187.95","($59,363.91)"
21,75293,USAble Mutual Insurance Company,AR,"$37,164,216.31","($1,661,548.73)","$1,799,059.63"
22,81392,UnitedHealthcare Insurance Company,AR,N/E,$-,"($633,751.37)"
23,89365,Federated Mutual Insurance Company,AR,N/E,$-,"($373,879.22)"
24,99685,Humana Insurance Company,AR,$0.00,"($106,659.16)",$-
25,23307,"Humana Health Plan, Inc.",AZ,"$2,289,096.26","$6,251,937.97","($6,031,056.26)"
26,40702,"UnitedHealthcare of Arizona, Inc.",AZ,N/E,$-,"($1,413,358.56)"
27,51485,Health Net Life Insurance Company,AZ,"$2,433,371.07","$5,075,983.13","$6,396,214.81"
28,53901,Blue Cross Blue Shield of Arizona,AZ,"$27,506,938.31","$29,716,531.05","($1,968,495.77)"
29,65441,"Phoenix Health Plans, Inc.",AZ,"$1,783,346.46","($32,866,201.10)",$-
30,66105,Humana Insurance Company,AZ,"$2,656,508.48","($1,311,469.26)","($1,065,223.04)"
31,70239,Health Choice Insurance Co,AZ,"$3,438,514.98","($9,159,037.15)",$-
32,70904,WMI Mutual Insurance Company,AZ,N/E,$-,"($59,130.69)"
33,75849,Freedom Life Insurance Company of America,AZ,$0.00,($175.68),$-
34,78611,Aetna Health Inc. (a PA corp.),AZ,"$1,544,043.36","($8,516,682.29)","($7,293.51)"
35,82011,UnitedHealthcare Insurance Company,AZ,N/E,$-,"$5,204,264.49"
36,84251,Aetna Life Insurance Company,AZ,$0.00,"$41,466.11","$1,799,959.40"
37,86830,Cigna Health and Life Insurance Company,AZ,"$576,234.39","$1,169,118.87","$28,617.42"
38,90169,UnitedHealthcare Life Insurance Company,AZ,"$822,635.08","($819,920.79)",$-
39,91450,"Health Net of Arizona, Inc.",AZ,"$4,433,397.90","$9,901,556.20","($2,809,420.30)"
40,97667,"Cigna HealthCare of Arizona, Inc",AZ,"$1,135,299.23","($1,946,342.41)","($107,879.38)"
41,98971,All Savers Insurance Company,AZ,"$13,230,750.73","$2,463,235.36","$32,801.56"
42,10544,Oscar Health Plan of California,CA,"$270,244.26","($4,894,494.13)",$-
43,18126,Molina Healthcare of California,CA,"$3,087,612.70","($106,521,339.27)",$-
44,20523,Aetna Health of California Inc.,CA,N/E,$-,"($30,584,653.01)"
45,27330,Kaiser Permanente Insurance Company,CA,N/E,$-,"($331,349.12)"
46,27603,Blue Cross of California(Anthem BC),CA,"$210,252,593.47","$49,496,966.88","$216,503,893.64"
47,37873,UnitedHealthcare Benefits Plan of California,CA,"$790,860.23","$425,818.57",$-
48,40025,Cigna Health and Life Insurance Company,CA,"$7,651,494.69","$6,391,520.32",$-
49,40513,"Kaiser Foundation Health Plan, Inc.",CA,"$99,483,995.87","($182,807,948.20)","($254,946,663.78)"
50,40733,Aetna Life Insurance Company,CA,N/E,$-,"$22,400,144.48"
51,47579,Chinese Community Health Plan,CA,"$2,031,826.13","($24,844,080.41)","($2,248,025.07)"
52,49116,UHC of California,CA,N/E,$-,"($15,840,917.19)"
53,56887,Ventura County Health Care Plan,CA,N/E,$-,"$274,684.29"
54,64210,Sutter Health Plan,CA,"$404,789.48","$52,744.83","($12,698,603.21)"
55,64618,National Health Insurance Company,CA,N/E,$-,"$270,905.91"
56,67138,"Health Net of California, Inc.",CA,"$24,670,172.12","($53,862,013.99)","($41,807,057.69)"
57,70285,CA Physician's Service dba Blue Shield of CA,CA,"$200,597,192.85","$265,442,825.10","$105,943,814.59"
58,84014,Valley Health Plan,CA,"$315,872.69","($2,983,496.65)",$-
59,92499,Sharp Health Plan,CA,"$6,648,728.33","$5,351,707.64","($9,546,508.28)"
60,92815,Local Initiative Health Authority for Los Angeles County,CA,"$24,557.63","($12,354,890.24)",$-
61,93689,Western Health Advantage,CA,"$3,454,688.21","($4,446,832.83)","$2,191,329.00"
62,95677,UnitedHealthcare Insurance Company,CA,N/E,$-,"($6,770,926.79)"
63,99110,Health Net Life Insurance Company,CA,"$23,086,888.56","$65,553,512.41","$27,189,932.09"
64,21032,Kaiser Foundation Health Plan of Colorado,CO,"$16,419,013.45","($59,023,683.88)","($3,316,114.09)"
65,28700,Freedom Life Insurance Company of America,CO,"$189,050.16","$530,940.43",$-
66,35944,Kaiser Permanente Insurance Company,CO,N/E,$-,"($169,078.93)"
67,39041,Aetna Life Insurance Company,CO,N/E,$-,"($394,940.49)"
68,41341,Golden Rule Insurance Company,CO,"$798,771.78","($2,721,557.27)",$-
69,49375,Cigna Health and Life Insurance Company,CO,"$6,707,081.89","$1,238,103.55",$-
70,59036,"UnitedHealthcare of Colorado, Inc.",CO,"$1,537,280.69","$6,746,077.39","($8,152,391.81)"
71,63312,Colorado Choice Health Plans,CO,"$3,886,517.25","($2,794,252.54)","$28,711.53"
72,66699,"Denver Health Medical Plan, Inc.",CO,"$297,354.64","$2,810,015.23",$-
73,67879,UnitedHealthcare Insurance Company,CO,N/E,$-,"$18,066,220.34"
74,74320,Humana Health Plan,CO,"$4,384,982.12","$19,133,063.67","($1,635,879.75)"
75,76680,HMO Colorado Inc(Anthem BCBS),CO,"$6,296,226.19","($22,957,774.05)","($5,766,680.60)"
76,79509,Humana Insurance Company,CO,"$164,260.09","$719,860.70","$621,087.18"
77,80208,Rocky Mountain HealthCare Options Inc,CO,N/E,$-,"$2,715,286.61"
78,87269,Rocky Mountain Hos&Med Svc(Anthem BCBS),CO,"$27,109,001.49","$43,292,191.96","$947,344.48"
79,92137,All Savers Insurance Company,CO,"$129,784.97","$939,139.28",$-
80,92291,UnitedHealthcare Life Insurance Company,CO,"$1,059,369.38","$1,604,316.11",$-
81,97879,Rocky Mountain Health Maintenance Organization Inc,CO,"$8,180,224.47","$10,483,559.33","($2,943,564.31)"
82,29462,"Oxford Health Insurance, Inc.",CT,N/E,$-,"$6,196,764.55"
83,39159,Aetna Life Insurance Company,CT,"$1,447,448.75","$789,659.17","$5,293,151.42"
84,40591,Golden Rule Insurance Company,CT,"$721,248.97","($418,099.60)",$-
85,49650,UnitedHealthcare Insurance Company,CT,"$1,599,327.73","$2,483,964.33","($125,543.67)"
86,71179,"Oxford Health Plans (CT), Inc.",CT,N/E,$-,"($59,675.40)"
87,75091,"ConnectiCare, Inc.",CT,"$49,691.37","($1,145,321.71)","($266,957.78)"
88,76962,"ConnectiCare Benefits, Inc.",CT,"$14,049,522.77","($1,673,116.38)",$-
89,85732,UnitedHealthcare Life Insurance Company,CT,"$518,105.55","$810,976.08",$-
90,86545,Anthem Health Plans Inc(Anthem BCBS),CT,"$20,499,214.04","$24,193,391.03","$14,278,900.63"
91,87354,Cigna Health and Life Insurance Company,CT,"$535,710.84","$1,027,304.78",$-
92,89130,"HPHC Insurance Company, Inc.",CT,N/E,$-,"($14,809,373.05)"
93,91069,"HealthyCT, Inc.",CT,"$6,340,096.71","($745,863.30)","($7,270,795.39)"
94,94815,"ConnectiCare Insurance Company, Inc.",CT,"$11,523,325.35","($25,322,894.30)","($3,713,490.75)"
95,95882,"Harvard Pilgrim Health Care of Connecticut, Inc.",CT,N/E,$-,"$477,019.49"
96,21066,"UnitedHealthcare of the Mid-Atlantic, Inc.",DC,N/E,$-,"($208,559.67)"
97,41842,UnitedHealthcare Insurance Company,DC,N/E,$-,"($2,167,698.98)"
98,73987,Aetna Health Inc. (a PA corp.),DC,N/E,$-,"($521,995.34)"
99,75753,"Optimum Choice, Inc.",DC,N/E,$-,"$308,133.57"
100,77422,Aetna Life Insurance Company,DC,N/E,$-,"($278,383.82)"
101,78079,Group Hospitalization and Medical Services,DC,"$2,918,352.18","$9,810,171.94","$16,753,749.82"
102,86052,CareFirst BlueChoice,DC,"$1,167,287.99","($7,984,910.32)","($12,225,393.95)"
103,94506,"Kaiser Foundation Health Plan of the MidAtlantic States, Inc.",DC,"$152,397.44","($1,825,261.64)","($1,659,851.69)"
104,29497,Aetna Life Insurance Company,DE,"$1,002,995.37","($617,987.08)","($609,891.66)"
105,61021,UnitedHealthcare Insurance Company,DE,N/E,$-,"($235,174.40)"
106,67190,Aetna Health Inc. (a PA corp.),DE,"$343,162.44","($1,048,438.16)","$89,309.00"
107,76168,Highmark BCBSD Inc.,DE,"$11,767,372.01","$1,665,503.00","$768,074.20"
108,81914,"Coventry Health Care of Delaware, Inc.",DE,$0.00,$-,"$31,586.04"
109,89587,Golden Rule Insurance Company,DE,"$42,201.07",$922.26,$-
110,97569,"Optimum Choice, Inc.",DE,N/E,$-,"($43,903.22)"
111,16842,Blue Cross Blue Shield of FL Inc.,FL,"$126,761,966.46","$464,434,259.85","$24,467,625.00"
112,17341,UnitedHealthcare Life Insurance Company,FL,"$6,190,397.67","$3,944,039.65",$-
113,18628,Aetna Health Inc. (a FL corp.),FL,"$6,467,391.19","($19,679,828.24)","$6,118,081.67"
114,19898,"AvMed, Inc",FL,"$4,504,028.34","($5,705,014.67)","($7,819,786.24)"
115,21663,Celtic Insurance Company,FL,"$7,217,586.61","($160,888,837.15)",$-
116,23841,Aetna Life Insurance Company,FL,"$184,616.94","($1,657,914.80)","$2,505,152.50"
117,27357,Health First Health Plans,FL,"$3,159,908.04","$1,792,502.93","($1,024,411.33)"
118,30252,"Health Options, Inc.",FL,"$38,308,523.89","($6,728,057.44)","($14,039,797.34)"
119,35783,"Humana Medical Plan, Inc.",FL,"$73,556,881.87","($1,588,085.51)","($8,475,356.54)"
120,40442,Freedom Life Insurance Company of America,FL,"$92,026.59","$173,446.74",$-
121,42204,All Savers Insurance Company,FL,N/E,$-,"($130,253.39)"
122,43839,UnitedHealthcare Insurance Company,FL,N/E,$-,"$5,443,321.07"
123,48121,Cigna Health and Life Insurance Company,FL,"$4,687,309.64","$11,336,832.52",$-
124,54172,"Molina Healthcare of Florida, Inc.",FL,"$25,476,629.62","($252,569,063.08)",$-
125,56503,"Florida Health Care Plan, Inc",FL,"$3,533,832.47","($11,167,504.61)","($790,753.33)"
126,57451,"Coventry Health Care of Florida, Inc.",FL,"$28,788,522.60","($112,203,006.16)","($13,019.42)"
127,66966,Capital Health Plan,FL,N/E,$-,"$1,417,443.48"
128,68398,"UnitedHealthcare of Florida, Inc.",FL,"$35,522,703.08","$93,698,886.73","($6,990,459.62)"
129,77150,Health First Insurance,FL,$0.00,$-,"($315,764.28)"
130,80779,"Neighborhood Health Partnership, Inc.",FL,N/E,$-,"($241,201.26)"
131,83883,Florida Health Solution HMO Company,FL,$0.00,"($247,811.02)",$-
132,99308,"Humana Health Insurance Co of FL, Inc.",FL,"$380,796.07","($2,944,845.74)","($110,820.97)"
133,12442,Nippon Life Insurance Company of America,GA,N/E,$-,"$63,937.58"
134,13535,UnitedHealthcare Insurance Company,GA,N/E,$-,"$2,215,054.29"
135,24775,Celtic Insurance Company,GA,$0.00,"($1,334.54)",$-
136,30552,UnitedHealthcare Insurance Company of the River Valley,GA,N/E,$-,"($5,376,525.71)"
137,37001,Humana Insurance Company,GA,$0.00,"($131,960.47)","$644,608.47"
138,38835,Federated Mutual Insurance Company,GA,N/E,$-,"$717,318.50"
139,43802,"UnitedHealthcare of Georgia, Inc.",GA,"$10,095,250.90","$26,478,561.73","($378,394.27)"
140,49046,"Blue Cross Blue Shield Healthcare Plan of Georgia, Inc.",GA,"$31,779,370.22","($26,403,372.35)","$1,830,323.65"
141,50491,Cigna Health and Life Insurance Company,GA,"$1,923,749.48","($770,019.98)",$-
142,63411,"Blue Cross and Blue Shield of Georgia, Inc.",GA,N/E,$-,"$2,429,075.84"
143,65890,Coventry Health and Life,GA,N/E,$-,"($33,628.54)"
144,70893,Ambetter of Peach State,GA,"$3,618,457.84","($76,682,881.13)",$-
145,72796,Freedom Life Insurance Company of America,GA,$0.00,"($5,238.21)",$-
146,74189,UnitedHealthcare Life Insurance Company,GA,"$380,604.01","$368,431.18",$-
147,82302,Kaiser Permanente Insurance Company,GA,N/E,$-,"($12,680.30)"
148,82824,Aetna Health Inc. (a GA corp.),GA,"$12,594,972.21","($49,061,684.16)","($5,012,021.19)"
149,83761,Alliant Health Plans,GA,"$4,838,655.10","$6,096,822.55","($246,485.61)"
150,83978,Aetna Life Insurance Company,GA,"$7,209,783.66","($7,286,899.98)","$11,869,948.22"
151,89942,"Kaiser Foundation Health Plan of Georgia, Inc.",GA,"$6,557,804.67","($16,261,579.31)","($2,129,295.27)"
152,93332,"Humana Employers Health Plan of Georgia, Inc.",GA,"$91,484,441.32","$143,941,804.74","($6,580,193.74)"
153,95852,Harken Health Insurance Company,GA,"$3,731,952.84","($280,650.18)","($1,041.78)"
154,14479,Family Health Hawaii mbs,HI,N/E,$-,"($939,110.78)"
155,18350,Hawaii Medical Service Association,HI,"$10,348,585.13","$16,511,893.78","$11,809,305.09"
156,54179,UnitedHealthcare Insurance Company,HI,N/E,$-,"$11,551.76"
157,56682,Hawaii Medical Assurance Association,HI,N/E,$-,"$65,520.51"
158,60612,"Kaiser Foundation Health Plan, Inc.",HI,"$2,908,866.08","($16,511,893.77)","($7,404,335.42)"
159,95366,University Health Alliance,HI,N/E,$-,"($3,542,931.19)"
160,18973,Aetna Health Inc. (a IA corp.),IA,"$8,633,362.73","($10,630,845.15)","($547,628.54)"
161,25896,"Wellmark Health Plan of Iowa, Inc",IA,"$809,644.81","($5,781,185.31)","($3,821,568.70)"
162,27651,"Gundersen Health Plan, Inc.",IA,"$129,669.29","$365,003.85","($143,577.92)"
163,41397,Federated Mutual Insurance Company,IA,N/E,$-,"$296,594.53"
164,50735,Medical Associates Health Plans,IA,N/E,$-,"$197,922.92"
165,51474,Pekin Life Insurance Company,IA,N/E,$-,"($235,836.64)"
166,51820,Coventry Health and Life,IA,N/E,$-,"($1,783.49)"
167,51902,"UnitedHealthcare of the Midlands, Inc.",IA,"$2,982,254.78","($2,226,287.05)",$-
168,56610,"UnitedHealthcare Plan of the River Valley, Inc.",IA,N/E,$-,"$697,193.19"
169,72160,"Wellmark, Inc",IA,"$10,380,245.12","$18,333,352.61","$4,987,083.29"
170,74980,"Avera Health Plans, Inc.",IA,"$68,679.80","$248,195.33","($83,219.11)"
171,77638,"Health Alliance Midwest, Inc.",IA,N/E,$-,"($31,283.34)"
172,81839,UnitedHealthcare Life Insurance Company,IA,"$119,924.56","($248,705.20)",$-
173,85930,Sanford Health Plan,IA,$0.00,$-,"($48,830.67)"
174,88678,UnitedHealthcare Insurance Company,IA,N/E,$-,"($1,265,065.53)"
175,93078,Medica Insurance Company,IA,"$559,351.02","($59,528.99)",$-
176,26002,SelectHealth,ID,"$12,396,300.65","$2,728,291.54","($1,742,435.08)"
177,38128,Montana Health Cooperative,ID,"$2,870,073.66","($8,100,585.26)","($189,468.28)"
178,43541,National Health Insurance Company,ID,N/E,$-,"($211,403.47)"
179,44648,Regence Blue Shield of Idaho,ID,"$764,325.42","($319,665.28)","($1,115,977.31)"
180,50118,UnitedHealthcare Insurance Company,ID,N/E,$-,"$139,603.64"
181,59765,BridgeSpan Health Company (ID),ID,"$1,020,878.60","($6,574,515.53)",$-
182,60597,PacificSource Health Plans,ID,"$38,751.09","$303,111.16","($116,759.35)"
183,61175,Altius Health Plans Inc.,ID,N/E,$-,"$110,858.26"
184,61589,Blue Cross of Idaho,ID,"$14,007,899.33","$11,963,363.34","$3,125,581.67"
185,16724,"UnitedHealthcare of the Midwest, Inc.",IL,"$2,237,882.20","($2,438,597.21)",$-
186,18389,Pekin Life Insurance Company,IL,N/E,$-,"($303,027.88)"
187,20129,"Health Alliance Medical Plans, Inc.",IL,"$10,389,731.85","$1,925,800.26","$572,733.12"
188,24301,Medical Associates Health Plans,IL,N/E,$-,"($171,931.50)"
189,27833,Celtic Insurance Company,IL,"$378,771.57","($61,352,776.51)",$-
190,34446,UnitedHealthcare Insurance Company of the River Valley,IL,N/E,$-,"$632,447.67"
191,35670,Coventry Health and Life,IL,"$2,361,904.97","$2,420,350.88","$359,296.65"
192,36096,Blue Cross Blue Shield of Illinois,IL,"$108,205,116.56","$36,348,043.52","$6,244,224.14"
193,42529,"UnitedHealthcare of Illinois, Inc.",IL,N/E,$-,"($547,051.46)"
194,53586,Nippon Life Insurance Company of America,IL,N/E,$-,($182.34)
195,58239,"UnitedHealthcare Plan of the River Valley, Inc.",IL,N/E,$-,"($646,169.48)"
196,58288,"Humana Health Plan, Inc.",IL,"$889,216.13","$1,493,121.70","($2,268,324.01)"
197,66143,Federated Mutual Insurance Company,IL,N/E,$-,"($343,024.90)"
198,66303,UnitedHealthcare Life Insurance Company,IL,"$660,431.60","$904,689.42",$-
199,68303,Humana Insurance Company,IL,$0.00,$-,"$2,376,088.32"
200,72547,Aetna Life Insurance Company,IL,"$2,158,123.97","($7,044,744.34)","$1,102,953.11"
201,78463,Harken Health Insurance Company,IL,"$12,226,130.79","$19,685,102.97","($13,530.38)"
202,79763,Land of Lincoln Mutual Health Insurance Company,IL,"$9,157,710.03","($11,963,347.32)","($9,752,011.63)"
203,82506,Freedom Life Insurance Company of America,IL,$0.00,"$48,327.14",$-
204,92476,UnitedHealthcare Insurance Company of Illinois,IL,N/E,$-,"$2,021,972.27"
205,96601,"Coventry Health Care of Illinois, Inc.",IL,"$14,270,273.67","$35,950,670.67","$728,924.09"
206,99129,Aetna Health Inc. (a PA corp.),IL,"$1,221,767.25","($15,976,640.99)","$6,614.37"
207,11104,Federated Mutual Insurance Company,IN,N/E,$-,"$505,888.05"
208,17575,Anthem Ins Companies Inc(Anthem BCBS),IN,"$24,145,897.47","$23,453,648.50","$11,000,596.02"
209,20855,"Advantage Health Solutions, Inc.",IN,N/E,$-,"($146,514.00)"
210,32378,Aetna Life Insurance Company,IN,N/E,$-,"($325,097.82)"
211,33380,"Indiana University Health Plans, Inc",IN,"$3,082,188.68","($38,452,436.14)","($375,536.06)"
212,36373,All Savers Insurance Company,IN,"$11,167,169.27","$33,816,665.08","$5,460.99"
213,43070,UnitedHealthcare Life Insurance Company,IN,"$10,046,546.69","($3,573,506.68)",$-
214,43442,Humana Health Plan,IN,N/E,$-,"$63,336.28"
215,50816,"Physicians Health Plan of Northern Indiana, Inc.",IN,"$2,286,473.37","($2,126,520.47)","($124,000.57)"
216,54192,"CareSource Indiana, Inc",IN,"$3,002,557.32","($15,288,511.46)",$-
217,62033,MDwise Marketplace Inc.,IN,"$6,092,060.35","($457,849.10)",$-
218,67920,Southeastern Indiana Health Organization,IN,"$40,069.71","($583,807.56)","($633,214.19)"
219,72850,UnitedHealthcare Insurance Company,IN,N/E,$-,"($10,746,407.83)"
220,76179,Celtic Insurance Company,IN,"$2,148,267.03","$3,089,884.00",$-
221,79828,Pekin Life Insurance Company,IN,N/E,$-,"($285,888.78)"
222,98761,Nippon Life Insurance Company of America,IN,N/E,$-,"($107,606.64)"
223,99791,Humana Insurance Company,IN,"$6,361.47","$122,433.72","$1,168,984.38"
224,18558,"Blue Cross and Blue Shield of Kansas, Inc",KS,"$11,808,950.32","$31,581,487.09","($649,337.25)"
225,19968,Humana Insurance Company,KS,$0.00,"$1,652.45","$2,126,319.62"
226,27811,"Blue Cross and Blue Shield of Kansas, Inc",KS,"$9,049,900.15","($25,030,909.74)","($1,212,849.04)"
227,34368,Celtic Insurance Company,KS,$0.00,"$9,128.22",$-
228,41446,UnitedHealthcare Life Insurance Company,KS,"$92,547.10","($134,489.36)",$-
229,49857,"Humana Health Plan, Inc.",KS,N/E,$-,"($32,854.53)"
230,50274,"UnitedHealthcare of the Midwest, Inc.",KS,"$2,190,404.93","($6,918,671.85)",$-
231,54822,Freedom Life Insurance Company of America,KS,$0.00,($334.95),$-
232,57850,Aetna Health Inc. (a PA corp.),KS,N/E,$-,"($738,798.19)"
233,61430,Coventry Health and Life,KS,"$3,045,695.42","($11,830,329.41)","($14,621.47)"
234,65598,Coventry Health Care,KS,"$525,206.15","($2,303,279.85)","($618,249.46)"
235,84600,Aetna Life Insurance Company,KS,N/E,$-,"$190,344.76"
236,94248,Blue Cross and Blue Shield of Kansas City,KS,"$10,536,962.27","$14,625,747.47","$1,720,681.91"
237,94968,UnitedHealthcare Insurance Company,KS,N/E,$-,"($164,494.80)"
238,96352,Federated Mutual Insurance Company,KS,N/E,$-,"($606,141.63)"
239,15411,"Humana Health Plan, Inc.",KY,"$3,650,974.52","$4,158,571.20","($2,971,979.56)"
240,23671,"UnitedHealthcare of Kentucky, Ltd.",KY,"$925,945.86","$3,445,308.96","($2,631,108.88)"
241,28773,UnitedHealthcare Insurance Company,KY,N/E,$-,"($222,329.46)"
242,34822,Aetna Health Inc. (a PA corp.),KY,"$1,881.63","($1,109,860.03)",$-
243,36239,Anthem Health Plans of KY(Anthem BCBS),KY,"$18,494,891.83","$6,598,201.98","$7,952,464.11"
244,40586,Bluegrass Family Health,KY,"$945,747.27","($9,882,852.36)","($1,696,866.11)"
245,45636,CareSource Kentucky Co.,KY,"$954,253.69","($6,276,507.50)",$-
246,45920,"UnitedHealthcare of Ohio, Inc.",KY,N/E,$-,"($430,179.98)"
247,47949,Golden Rule Insurance Company,KY,"$125,485.16","($458,879.82)",$-
248,56744,UnitedHealthcare Life Insurance Company,KY,"$783,885.23","$3,947,860.40",$-
249,72001,"WELLCARE HEALTH PLANS OF KENTUCKY, INC",KY,"$81,208.69","($421,842.76)",$-
250,14030,Aetna Life Insurance Company,LA,N/E,$-,"$123,351.62"
251,19636,"HMO Louisiana, Inc.",LA,"$11,110,876.79","($46,288,576.05)","($1,630,163.09)"
252,19913,Freedom Life Insurance Company of America,LA,"$84,736.66","$107,216.79",$-
253,22381,Coventry Health and Life,LA,N/E,$-,"($113,751.90)"
254,38499,"UnitedHealthcare of Louisiana, Inc.",LA,"$9,458,361.87","($6,169,146.20)","$847,159.64"
255,44965,"Humana Health Benefit Plan of Louisiana, Inc.",LA,"$4,491,146.79","($32,450,558.97)","($6,832,225.23)"
256,53946,UnitedHealthcare Insurance Company of the River Va,LA,N/E,$-,"($94,119.45)"
257,66593,UnitedHealthcare Life Insurance Company,LA,"$105,487.33","($1,690,229.40)",$-
258,67243,Vantage Health Plan,LA,"$3,635,462.07","($9,974,637.20)","$206,362.72"
259,69842,UnitedHealthcare Insurance Company,LA,N/E,$-,"($1,019,726.31)"
260,81941,Aetna Health Inc. (a LA corp.),LA,"$664,684.81","($6,121,430.71)","($644,489.03)"
261,93653,All Savers Insurance Company,LA,N/E,$-,"($1,098.79)"
262,97176,Louisiana Health Service & Indemnity Company,LA,"$27,115,074.86","$102,587,361.66","$9,158,699.82"
263,24675,"Blue Cross and Blue Shield of Massachusetts, Inc.",MA,"$82,290.16",N/A_MA_Issuer,N/A_MA_Issuer
264,29125,Tufts Associated Health Maintenance Organization Inc.,MA,"$5,199,875.77",N/A_MA_Issuer,N/A_MA_Issuer
265,31234,CeltiCare Health Plan of Massachusetts,MA,"$1,877.17",N/A_MA_Issuer,N/A_MA_Issuer
266,31779,UnitedHealthcare Insurance Company,MA,"$284,246.24",N/A_MA_Issuer,N/A_MA_Issuer
267,34484,Health New England,MA,"$1,201,283.84",N/A_MA_Issuer,N/A_MA_Issuer
268,36046,Harvard Pilgrim Health Care Inc.,MA,"$4,809,705.87",N/A_MA_Issuer,N/A_MA_Issuer
269,38712,Tufts Associated Health Maintenance Organization Inc.,MA,"$421,450.61",N/A_MA_Issuer,N/A_MA_Issuer
270,41304,"Neighborhood Health Plan, Inc",MA,"$16,412,212.24",N/A_MA_Issuer,N/A_MA_Issuer
271,42690,"Blue Cross and Blue Shield of Massachusetts HMO Blue, Inc.",MA,"$17,178,148.51",N/A_MA_Issuer,N/A_MA_Issuer
272,52710,Fallon Life and Health Assurance Co,MA,"$62,239.08",N/A_MA_Issuer,N/A_MA_Issuer
273,59763,"Tufts Health Public Plans, Inc.",MA,"$4,141,413.43",N/A_MA_Issuer,N/A_MA_Issuer
274,73331,"Minuteman Health, Inc.",MA,"$368,156.26",N/A_MA_Issuer,N/A_MA_Issuer
275,82569,"Boston Medical Center Health Plan, Inc.",MA,"$1,568,492.99",N/A_MA_Issuer,N/A_MA_Issuer
276,88806,Fallon Community Health Plan,MA,"$915,565.55",N/A_MA_Issuer,N/A_MA_Issuer
277,88950,ConnectiCare of Massachusetts Inc.,MA,$0.00,N/A_MA_Issuer,N/A_MA_Issuer
278,95878,HPHC Insurance Company Inc.,MA,"$2,766,034.85",N/A_MA_Issuer,N/A_MA_Issuer
279,14468,"Coventry Health Care of Delaware, Inc.",MD,N/E,$-,"($454,038.82)"
280,23620,UnitedHealthcare Insurance Company,MD,N/E,$-,"($1,895,792.87)"
281,28137,CareFirst BlueChoice,MD,"$30,916,285.31","($9,848,840.41)","($6,824,378.98)"
282,31112,"UnitedHealthcare of the Mid-Atlantic, Inc.",MD,"$1,196,462.13","($4,726,063.80)","($2,228,250.33)"
283,32812,Cigna Health and Life Insurance Company,MD,"$456,704.97","$1,770,732.37",$-
284,36677,All Savers Insurance Company,MD,"$576,817.20","$1,316,533.03",$-
285,45532,CareFirst of Maryland,MD,"$9,220,852.27","$21,010,173.45","$9,161,612.58"
286,65635,MAMSI Life and Health Insurance Company,MD,N/E,$-,"($2,805,605.00)"
287,66516,Aetna Health Inc. (a PA corp.),MD,N/E,$-,"($1,109,601.09)"
288,68541,Coventry Health and Life,MD,N/E,$-,"($540,405.53)"
289,70767,Aetna Life Insurance Company,MD,N/E,$-,"($904,266.78)"
290,72375,"Optimum Choice, Inc.",MD,N/E,$-,"($2,947,755.59)"
291,72564,Evergreen Health,MD,"$2,540,644.79","$1,224,227.52","($10,613,469.40)"
292,90296,"Kaiser Foundation Health Plan of the MidAtlantic States, Inc.",MD,"$3,816,924.66","($29,417,473.49)","$2,554,219.07"
293,94084,Group Hospitalization and Medical Services,MD,"$7,161,965.94","$18,670,711.32","$18,607,732.84"
294,11593,HPHC Insurance Company Inc.,ME,"$353,431.61","$617,069.84","$2,126,973.99"
295,33653,Maine Community Health Options,ME,"$17,217,074.37","$5,309,414.63","($1,592,009.09)"
296,48396,Anthem Health Plans of ME(Anthem BCBS),ME,"$3,475,090.31","($5,023,772.82)","$1,897,677.07"
297,53357,Aetna Life Insurance Company,ME,N/E,$-,"$713,025.50"
298,73250,Aetna Health Inc. (a ME corp.),ME,"$92,757.12","($370,234.08)","($154,409.60)"
299,90214,UnitedHealthcare Insurance Company,ME,N/E,$-,"$21,880.11"
300,96667,Harvard Pilgrim Health Care Inc.,ME,"$2,922,966.87","($532,477.48)","($3,013,138.00)"
301,13667,HealthPlus Insurance Company,MI,"$19,784.98","($1,118,038.80)","($113,837.62)"
302,15560,Blue Cross Blue Shield of Michigan Mutual Insurance Company,MI,"$45,860,204.98","$117,279,775.33","$27,642,465.18"
303,20393,McLaren Health Plan,MI,N/E,$-,"($305,892.99)"
304,20662,PHP Insurance Company,MI,N/E,$-,"$511,519.60"
305,29241,Priority Health,MI,"$3,777,289.50","$5,900,733.25","$1,298,105.46"
306,29698,Priority Health,MI,"$14,623,284.20","($34,476,293.74)","($2,495,450.95)"
